,Asset Name,Main Category,Date,Bell Labs People,Keywords,,,,,,Description
68,Chapin-86-301773,Physics,1954,Daryl Chapin,Solar Energy,Solar Battery,Murray Hill,Solar Cell,Sustainability,,"Sunlight is providing the power to turn this motor driven wheel at Bell Telephone Laboratories. The first successful device to convert useful amounts of the suns energy directly and efficiently into electricity the Bell solar battery is held by D M Chapin. An electrical engineer, he is one of a three member team of Laboratories scientists who invented the battery. Others are G.L. Pearson, physicist, and C.S. Fuller, chemist. Using strips of specially prepared silicon abut the size of common razor blades, Bell Laboratories had been able to achieve a six per cent efficiency, which compares favorably with the efficiency of steam and gasoline engines in contrast with other photoelectric devices which have never been rated higher than one per cent."
69,CPF-86-301771,Physics,1954,"Gerald Pearson, Calvin S. Fuller, Daryl Chaping",Solar Energy,Solar Battery,Murray Hill,Solar Cell,Sustainability,,"Inventors of the solar cell, Gerald L. Pearson, Daryl M. Chapin and Calvin S. Fuller, are shown at Bell Telephone Laboratories in a 1954 photo checking sample device for the sun in this demonstration. Their invention could deliver 50 watts of electricity per square yard of surface, achieving a conversion efficiency of six percent."
70,Fuller with glass,Physics,1954,Calvin S. Fuller,Solar Energy,Solar Battery,Murray Hill,Solar Cell,Sustainability,,Bell Telephone Laboratories chemist C.S. Fuller holds a tube used to prepare silicon for the Bell Solar battery. The battery is the invention of a three man team of Bell Laboratories scientists. It is the first successful device to convert the suns energy directly and efficiently into useful amounts of electricity. Strips of silicon are treated under gas at high temperatures to permit the intoduction of minute traces of impurities into the atomic structure at the surface of the silicon.
71,MH-lawn,Physics,1954,D.E. Thomas,Solar Energy,Solar Battery,Murray Hill,Solar Cell,Sustainability,,"Sunlight falling on a solar cell array powered a small radio transmitter in this Bell Labs demonstration in 1954 of the first silicon photovoltaic device. Engineer D.E. Thomas spoke into a microphone and his voice was transmitted across the lawn of Bell Labs at Murray Hill, demonstation showed that photovoltaic devices could be put to practical uses, such as powering complex electronic circuits."
72,Outside at Murray Hill,Physics,1955,D.F. Ciccolella,Solar Energy,Solar Battery,Murray Hill,Solar Cell,Sustainability,,"Efficiency of the bell solar battery has been practically doubled in the one year since its annoucement, the Bell Laboratories disclosed today. Its efficiency is now as high as 11 per cent. Here D.F. Ciccolella, Bell Laboratories engineer, compares the electrical output of the battery with the total energy availability from the sun, as measured by a pyrheliometer."
73,Pearson at desk,Physics,1954,G.L. Pearson,Solar Energy,Solar Battery,Murray Hill,Solar Cell,Sustainability,,"Physicist G.L. Pearson of Bell Laboratories, inventor with chemist C.S. Fuller and electrical engineer D.M. Chapin of a solar battery which represents the first successful effort to convert the suns energy directly and efficiently into useful amounts of electricity. Mr. Pearson is here checking the power devivered by one of the silicon strips. These strips, extremely sensative to light, can be electrically linked together to convert power from the sun at the rate of 50 watts per square yard of surface. A broad fundamental program at Bell Laboratories for studying silicon and its possible application in modern electronics led to the development of the solar battery."
74,Solar Sample,Physics,1954,,Solar Energy,Solar Battary,Murray Hill,Solar Cell,Sustainability,,"A wafer thin strip of specially prepared silicon the size of an ordinary razor blade can convert energy from the sun directly and efficiently into electrical power. Invented at Bell Laboratories the solar battery has a six per cent efficiency which compares favorably with the efficiency of steam and gasoline engines in contrast with other photoelectric devices which have never been rated higher than one per cent Silicon, obtained from common sand, is one electronic stability at higher temperatures than other semiconductors used in electronics. The solar battery, consisting team of Bell Laboratories scientists."
75,solar-battery-86-301766,Physics,1954,,Solar Energy,Solar Battary,Murray Hill,Solar Cell,Sustainability,,"A solar battery invented at Bell Telephone Laboratories is the first successful device to convert useful amounts of the suns energy directly and efficiently into electricity The battery composed of strips of specially prepared silicon, has used the suns rays to power the transmission of voices over telephone wires and to power a transistor radio transmitter. Although the solar battery is still in the experimental stage, the Bell System envisions its use in telephony, in such equipment at mobile radio telephone systems and as sun powered battery chargers for rural telephone systems. The Bell solar battery was invented by a three member team of Bell Laboratories scientists."
76,solar-battery-88-202165,Physics,1954,,Solar Energy,Solar Battary,Murray Hill,Solar Cell,Sustainability,,Exhibit at Solar Battery Press Conference: How the Bell Solar Battery Works. ENERGY POWER SOLAR BATTERY DEMONSTRATION
77,solar,Physics,1955,,Solar Energy,Solar Battary,Murray Hill,Solar Cell,Sustainability,,"Bell Laboratories engineers make final tests on a solar battery which is now frunishing power directly to a rural telephone line. The Bell Solar Battery is the first successful device to convert the suns energy directly and efficiently into substantial amounts of electricity. Use of solar power is a part off experiments being conducted near Americus Ga., 135 miles south of Atlanta, to develope more and better rural telephone service."
78,Telephone Pole Experiment,Physics,1955,,Solar Energy,Solar Battary,Murray Hill,Solar Cell,Sustainability,,"Energy/Power Solar Battery - American, Georgia Trial - Bell Telephone engineer with a model of the Bell Solar Battery mounted on a section of telephone pole. The solar battery will receive its first practical test as part of the telephone system this summer when an experimental unit--essentially identical to the model shown--will be installed in America, Georgia, to supply power to terminal equipment on rural telephone lines. The heart of the solar battery is the specially prepared silicon disc which converts sunlight into electricity. This model contains 432 disks, arranged in 48 units of nine disks each. During daylight hours the solar battery will power terminal equipment directly and, at the same time, will charge a storage battery to provide power for night time operation and periods of lowered sun intensity. Flexible features of the mounting allow the face of the solar battery to be tilted to the most favorable angle for maximum sun exposure in any latitude."
79,Telephone Pole Mount,Physics,1955,,Solar Energy,Solar Battary,Murray Hill,Solar Cell,Sustainability,,"Bell Labs - Solar Cell & Battery - The Bell Solar Battery, being used in experiments, near America, Georgia, 135 miles south of Atlanta, to develop more and better rural telephone service. A Southern Bell cable repairman is adjusting the device to pick up the prevailing light. The solar battery is an invention of Bell Labs, announced last year. 10/4/1955"
80,Clown Color TV,Networks,1929,NA,color television,television,broadcasting,,,,"Pictured is transmitting apparatus used in first inter city television demonstration between Bell Telephone Laboratories in New York and Washington, D. C. The model's face was scanned by light beam coming through the opening in the cabinet directly in front of her. Photo electric cells, surrounding the opening, picked up reflected light and transmitted it as an electrical signal"
81,DEMO,Networks,192?,Dr. Frank Gray,television,broadcasting,,,,,"One form of receiving apparatus for television as set up in the auditorium of Bell Laboratories to receive from Washington by wire and from Whippany by radio. The distant scene is made visible to the audience on the glass screen in the center of the picture. Dr. Frank Gray, who is largely responsible for that method of receiving stands at the left, his hand resting on the screen, which is the loud speaking telephone. On the right, W. S. Bishop and E. Peterson manipulate the controls of the Amplifier and other associated equipment."
82,HOOVER 2,Networks,1927,,Herbert Hoover,broadcasting,television,,,,"Early show, When Herbert Hoover, than Secretary of commerce, looked into this camera on April 7, 1927, his image was transmitted from Washington, D. C. to Bell Laboratories in New York. The occasion was the first public demonstration of television between cities, and the experimenters were Bell Laboratories scientists"
83,HOOVER,Networks,9953,,Herbert Hoover,broadcasting,television,,,,"Herbert Hoover, then Secretary of Commerce, shown as he took part in the first public demonstration of intercity television broadcasting. Mr Hoover, speaking in Washington was seen on television screens at Bell Telephone Laboratoy in New York. Others in the picture, now deceased are General J. J. Carty vice president of the American Telephone and Telegraph Company, A. E. Berry, President of the Chesapeake and Potamac Telephone Companies, and Judge Stephen Davis, Solicitor for the Department of Commerce"
84,IVES DEMO,Networks,9959,Herbert Ives,phototelectric cell,television,broadcasting,,,,"Three big photoelectric cells, like the one held by Bell Laboratories Herbert Ives, were used to convert light to electrical signals in the first public demonstration of long distance television in the United States on April 7, 1927."
85,TV,Networks,9953,"Dr. Frank Gray (L), J. R. Hefele ",television,broadcasting,,,,,"The back of the early television receiving screen shows the hundreds of wires which connected to the different segments of the neon filled tubes. Current flowing from the transmitter, through these wires, created a pattern of light and dark areas on the tubes to form a picture. In the photo above are Dr. Frank Gray, Left, now retired from Bell Laboratories and living in St. Petersburg, Fla., and J. R. Hefele, who is still a member of the Laboratories"
86,Air to ground,Wireless,6440,NA,two way radio,radio,Western Electric,defense,air,WWI,"Two-Way Radio Aircraft - Early Models, Craft, Captain Bown, Major Levinson, Major Slaughter, Two-Way Radio Telephone Conversations Between Airplanes And Ground Were First Carried On Successfully In 1917. Ground Station Of Western Electric Apparatus Used In These Tests"
87,Airplane 2,Wireless,1918,NA,WWI,radio,Western Electric,two way radio,air,defense,"Radio Telephony - Airplane. Airplane equipped with radio telephone, showing the aviators' sound proof helmets and transmitters."
88,Radio Test Car,Wireless,NA,NA,radio,mobile,,,,,Photograph of man testing mobile radio equipment
89,Taking ship to shore readings,Wireless,1924,NA,mobile,radio,,,,,"Mobile Radio Telephone, 1924"
90,Thompson Ritchie Unix Inventors,Computer,1972,Ken Thompson,UNIX,inventor,computer program,teletypewriter,,,"Ken Thompson who helped develop unix and is a member of the computing science research center at Bell Labs, uses a teletypewriter to run a program on a unix based computer system"
91,Another Davisson and Germer,Phsics,9487,"C. J. Davisson, L. Hhermer",electronics tubes,electron vacuum,electron diffration,,,,"tubes, Dr. Clinton J. DAvisson and L. H. Germer with tube used in electronic diffraction work."
92,Davisson and Germer,Phsics,NA,"Dr. Clinton Davisson (L), Dr. Lester Germer",wave matter,wave tube,quantum physics,,,,"Experiments by Dr. Clinton Davisson (left) and Dr. Lester Germer (right) led to the discovery of the wave nature of matter. Dr. Davisson and Professor G. P. Thompson, a British scientist, shared the 1937 Nobel Prize in physics for the work."
93,Zone,Physics,1954,"W. G. Pfann (L), J. H. Scaff",,,,,,," The purest substances in the world, 99.99999 percent pure, are being made at Bell Labs by means of a new and extremely simple refining method developed there. These substances have only one atom of impurity in ten billion atoms of the material, about the same as a pinch of salt in 35 freight cars of sugar. The new process is already in use in the refining of germanium for transistors. W. G. Pfann, left, inventor of the so called zone melting process, is shown operating the refining equipment, while J. H. Scaff, who was closely associated with the development, holds a large single crystals of germanium purified by this technique"
94,i-2cbjQXj.jpg,Networks,2009,,Echo Cancellation,Network,,,,,"This picture shows the operation of the first application called Packet Acoustic Echo Cancellation in action on a Alcatel-Lucent 9980 platform. Specifically, it uses the forward signal as a reference for detecting and suppressing the echo in the reverse direction."";"
95,i-5wx6QTs-X2.jpg,Optical,2009,,Optical,MEMS,Microlense,,,,"The picture shows a collage of pictures of a linear array of Silicon microlenses. The lenses where used in a micromachine based 1xK switch with Dynamic Gain Equalization. The light collimated by the center lens was redirected by a tilting MEMS mirror to any of the other lenses. By shifting the beam towards the empty space between lenses the outgoing light intensity could be continuously attenuated."";"
96,i-5z2gd4p-XL.png,Physics,2009,,,Nanograss,,,,,"Mathematical modeling of near slip boundary condition provided by nanograss patterned surface under pressure driven fluid flow within a micro-channel. Analytic solutions of the fluid mechanics problems can be obtained using Schwarz0-Christoffel transformation, one of the constructive conformal mapping theory from complex analysis.The contour plots show the cross sectional velocity field of the fluid flow through circular pipe. Red color indicates higher the velocity region and as the velocity approaches zero the color becomes dark blue."";"
97,i-95Mp644.png,Optical,2009,,Sol-Gel,Fiber,Lightwave,,,,An optical fiber pre-form created by the sol-gel process developed at Bell Labs.  This pre-form contains a series of air holes.  The placement and size of these holes have been selected to create a microstructured multimode optical fiber.  This type of multimode fiber requires no chemical doping significantly lowering the cost of producing high bandwidth multimode optical fiber.  A computed fundamental optical mode profile is super imposed on the image
98,i-BF4Kvcp-XL,Physics,,,Magnetometer,Device,,,,,This picture shows the mechanical part of a micromachine based magnetometer. The device is entirely fabricated in single crystal silicon and suspended over a silicon substrate to allow it to move
99,i-d5DKgXs-XL,Physics,2009,,Controlled Knot,Quantum Computing,,,,,"This picture is a blueprint of instructions for moving particles around each other in order to perform a particularly simple quantum computation known as a controlled NOT.   In the approach of topological quantum computing, all computations are reduced to knots in this way "
100,i-DbBZqbk-XL,Optical,2009,,Optical,Lightwave,DWDM,Network,Device,,This is a picture of a 12x10Gb/s DWDM receiver module developed to increase the density of optical transmission systems. The module is a hybrid assembly of a 12 wavelength arrayed waveguide grating demultiplexing filter mounted vertically above a detector array. Laser cut silicon spacers provide a stable platform to couple the filter outputs to the detectors with a simple in-plane alignment. The detector array is wirebonded to an array of transimpedance amplifiers that provide 12 differential electrical outputs at 10Gb/s
101,i-fcx4v2j-XL,Wireless,2009,,Wireless,Base Station,Network,,,,"This shows simulated results of an unsuccessful attempt to synchronize TDD base stations by passively observing the TDD cycle of neighboring base stations and adjusting to match. Each dot represents a base station, color-coded to show TDD phase at one instant in time. The red and blue contour lines indicate phase disagreement, 0.05 cycle per contour line.<"
102,i-FkwrZp4-XL,Wireless,2009,,Wireless,Netwo4rk,,,,,This is not a satellite weather map! It shows the population distribution of wireless data subscribers by their resource consumption in a weekday in a major North America service provider. The higher the color temperature the denser the population. The islands are the clusters of devices/applications sharing similar resource usage pattern.  
103,i-Fr2Hnwr-XL,Physics,2009,,Physics,Metal Interconnects,Divice,,,,"Reliability physics of metal interconnects. Crater on the SEM image is created by \""explosion\"" of 2&mu;m wide Aluminum interconnect wire during high voltage and high current test"
104,i-kNjVF99-XL,Optical,2009,,Optical,Network,,,,,Microsecond scale simulated optical power traces for channels in an optical mesh network experiencing an uncontrolled optical power transient.  Cycles in the mesh give rise to the complex transient time dependence as channels trade power as they propagate through the network.  Simulations such as these help to guide the development of power control algorithms in transparent optical mesh networks
105,i-kTdDdrt-XL,Physics,2009,,Spacers,Device,,,,,"A combination of dry etched circular trenches, an oxide mask and wet etching is used to micromachine narrow, high uniformity spacers.  In over-etched samples the cake-pan shaped etch mask ends up sitting on the tip of a Silicon pyramid.  This figure shows two cake-pan etch masks gathered next to one still sitting on its pyramid. The cake-pans are 0.0005\"" across."";"
106,i-LvMxFSm-XL,Optical,2009,,Optical,Networks,,,,,"Sparsity patterns for a collage of matrices arising from finite element discretizations of the mass, momentum and energy transport equations for several different applications. The following descriptions are given clockwise from the upper-left matrix: (Blue matrix) buoyancy-driven thermal transport problem; (Red matrix) convective transport problem with multiple chemical species; (Multi-colored matrix) expanded view of the buoyancy-driven thermal transport matrix along the matrix diagonal near the lower right corner of the matrix, with matrix entries colored according to their equation and variable type; (Green matrix) flow of a highly-elastic polymeric liquid."";"
107,i-M7LQRVW-XL,Optical,2009,,Optical ,Device,Lightwave,,,,"This collage of images illustrate a polarisation rotation plate integrated with into a planar lightwave polarisation control circuit. The rotation plate is inserted into a shallow slot cut into the circuit and epoxied in place. The upper image is taken with unpolarised light. The lower two images are take with crossed polarisers in parallel and crossed states showing the rotation of the polarisation state of the light passing through the plate."";"
108,i-MfXbDLJ-XL,Optical,2009,,Diffraction,Microfluidics,,,,,Diffraction pattern associated with a confocal image of the gas/liquid interface of a water layer in contact with a superhydrophobic surface consisting of an array of 40 &mu;m diameter posts with 48.9 &mu;m post-to-post pitch. Measurements of the corresponding 3D image reconstruction show a partial wetting depth of approximately 10 &mu;m
109,i-mw8D2Tx,Physics,2009,,Heat Sink,Energy,,,,,"Numerical simulation of fluid flow and heat transfer in a porous, three-dimensional aluminum heat sink design that is 3 cm in length and width and 2.2 cm tall. Air flow direction is from left to right with a inlet mean velocity of 0.8 m/s and temperature of 300 K and an incident heat flux of 15 Watts at the base of the heat sink (bright red region). Colored traces correspond to temperature contours along streaklines in the flow. Computational grid consists of 3 million tetrahedral elements and flow field is described by the standard k-epsilon turbulence model"
110,i-N5sgwNh-XL,Optical,2009,,Optical,Lightwave,Modulation,Device,,,"Silicon-Micromachined Spatial Light Modulator (SLM) for free-space optical wavefront control at 1.55 &mu;m wavelength.  Partial view of a Piston-Tip-Tilt, 4096-element micromirror array. Most of the 120 &mu;m x 120 &mu;m mirrors have been removed to reveal the interleaved groups of four electrostatic comb-drive actuators that drive them.  Nomarski filtering is used to verify the motion of one of the actuators in the lower right corner (yellow and red coloring correspond to &plusmn; 5&deg; mechanical tilts"
111,i-nMtsSLp-X2,Optical,,,Optical,Lightwave,,,,,A picture of a monolithically integrated wavelength selective switch. 
112,i-Nr6sCgd-XL,Optical,2009,,Optical,Switching,MEMS,Lightwave,Device,,The picture shows a four by four array of surface micromachined two axis tilting mirrors. These mirrors where used in an all-optical switch
113,i-nshC7Vp-XL,Physics,2009,,Fractal,,,,,,"A fractal is a self-similar semi-geometric object, i.e., the parts of the image resemble the whole, displaying a beautiful blend of chaos and order that extends to the infinite. In fact, for XIX century mathematicians, Cantor and Dedekind, the basic axiom that defines infinite is that the part is equal to the whole. This optical microscope picture shows the fractal structures formed when a photoresists enclosed between two flat surfaces was annealed for a few minutes. The color scale has been chosen to emphasize the structures. Image size: 1mm x 1.4mm"
114,i-qgbC8kW,Optical,2009,,Power,Network,,,,,"The simulated transient power coupling in an optically transparent mesh network.  A 3dB decrease in optical power at the output of one node (X axis) of the network results in an output power change at all other nodes in the network (Y axis).  Figures such as this show critical power coupling paths in the network.  The power coupling is a complex interplay between amplifier physics, network topology, and network channel loading."";"
115,i-qM4p5Jc-XL,Physics,2009,,Wireless,Mimo,,,,,"This is a visual representation of a 32x32 matrix suitable for denoising a smooth signal that has been modulated by a particular Walsh-Hadamard pilot sequence. This filter, based on the Discrete Cosine Transform, can be used for efficient estimation of crosstalk channels in a Multiple-Input, Multiple Output Orthogonal Frequency Division Multiplexing application.  Possible applications in Next Generation Quilt Design are also being explored"
116,i-ssWt9wv-XL,Optical,2009,,Infrarred Sensor,,,,,,"The image shows a false color SEM of free standing micromachined pixels in an infrared (IR) sensor array. The paddles are designed to absorb long wave IR radiation causing a temperature increase. The golden bimorph arms (40um long) are thermal actuators that deflect the paddles as the temperature changes. These deflections are read out with visible light to generate a visible image of the IR scene for night vision applications."";"
117,i-tL6fRFW-XL,Optical,2009,,Optical,DWDM,Device,Lightwave,,,"This is a picture of a wafer of submounts for high-speed DWDM laser arrays. The submounts are created on silicon wafers which provide good thermal conductivity and a stable alignment platform. The laser array is flip-chip bonded to the submount via 60 solder bumps deposited onto the submount. Each chip has a recessed trench with high-delectric material to enable each laser to be modulated with a 10Gb/s RF signal."";"
118,i-TQ3CJ8V-XL,Physics,2009,,,,,,,,"Constant mean curvature surface associated with solution of the Young-Laplace equation for the gas/liquid interface shape of a pressurized fluid in contact with a superhydrophobic surface consisting of an array of circular posts of diameter 0.38 micron and 0.9 micron pitch. Color contours correspond to the depth of interface deflection into the superhydrophobic surface while triangles correspond to mesh tessellation of the interface. The gas/liquid interface is assumed to be pinned at the top, outer-periphery of the post (hollow, white circle in figure) and the domain depicts the unit cell surrounding a single post."";"
119,i-W78Vqwc-XL,Optical,2009,,Optical,MEMS,Device,,,,Micromachined test structures (modified Guckel Rings) used to determine the critical length for buckling in microbeams of different shapes (straight or waving diametral beams inside the rings) used as springs in micromirror arrays. Silicon oxide under the 100nm-thick polysilicon structures has been etched away in vapor-phase hydrofluoric acid to free the structures. Nomarski-filter coloring and interference fringes show that the structures are fully released
120,i-vtmN8pS-XL,Optical,2009,,Optical,MEMS,Device,,,,Micromachined test structures (modified Guckel Rings) used to determine the critical length for buckling in microbeams of different shapes (straight or waving diametral beams inside the rings) used as springs in micromirror arrays. Silicon oxide under the 100nm-thick polysilicon structures has been etched away in vapor-phase hydrofluoric acid to free the structures. Nomarski-filter coloring and interference fringes show that the structures are fully released
121,i-Vzv3WGh,Optical,2009,,Optical,MEMS,Device,,,,Micromachined test structures (modified Guckel Rings) used to determine the critical length for buckling in microbeams of different shapes (straight or waving diametral beams inside the rings) used as springs in micromirror arrays. Silicon oxide under the 100nm-thick polysilicon structures has been etched away in vapor-phase hydrofluoric acid to free the structures. Nomarski-filter coloring and interference fringes show that the structures are fully released
