,Asset Name,Main Category,Date,Bell Labs People,Keywords,,,,,,Description
122,i-vTBpq6B-XL,Optical,2009,,Optical,MEMS,Device,,,,Micromachined test structures (modified Guckel Rings) used to determine the critical length for buckling in microbeams of different shapes (straight or waving diametral beams inside the rings) used as springs in micromirror arrays. Silicon oxide under the 100nm-thick polysilicon structures has been etched away in vapor-phase hydrofluoric acid to free the structures. Nomarski-filter coloring and interference fringes show that the structures are fully released
123,i-wcGLtJG-XL,Optical,2009,,Optical,Lightwave ,DWDM,Device,Laser,,"This is a picture of a 10x10Gb/s DWDM transmitter module developed to increase the density of optical transmission systems. The module is a hybrid assembly of a 10 wavelength laser array that is flip-chip bonded to a silicon submount and optically coupled to an arrayed waveguide grating multiplexing filter. A ceramic fanout board is used to provide all the control signals and input RF data signals. The 10 wavelengths are output on a single optical fibre."";"
124,i-ZtdfQR8-XL,Physics,2009,,Spacer,Device,,,,,"A combination of dry etched circular trenches, an oxide mask and wet etching is used to micromachine narrow, high uniformity spacers.  In over-etched samples the cake-pan shaped etch mask ends up sitting on the tip of a Silicon pyramid. This figure shows a side view of a cake-pan sitting on the tip of its pyramid while a second cake-pan behind it lost its balance.  The cake-pans are 0.0005\"" across."";"
125,i-x2gkCsT-XL,Physics,2009,,Spacer,Device,,,,,"A combination of dry etched circular trenches, an oxide mask and wet etching is used to micromachine narrow, high uniformity spacers.  In over-etched samples the cake-pan shaped etch mask ends up sitting on the tip of a Silicon pyramid. This figure shows a side view of a cake-pan sitting on the tip of its pyramid while a second cake-pan behind it lost its balance.  The cake-pans are 0.0005\"" across."";"
,Video,,,,,,,,,,
1,Bell_Labs_In_Touch_With_the_Future,MULTI-MEDIA,,Wireless,Networks ,Computing,,,,,"This film briefly covers the Labs' research foci for the late 1980s. At the time, The company was a major source of information age technologies: microelectronics, lightwave, and software, with an eye towards future developments. The ultimate goal was to provide instant, inexpensive access to voice, image and data services anywhere in the telephone/data network. Microwaves, lasers, and fiber optics were all still in play in the late '80s in terms of data and voice communications for AT&T."
2,Horn Antenna-1,Physics,Nobel,Arno Penzias,Robert Wilson,Holmdel,,,,,
3,Inventing the future (HD),MULTI-MEDIA,,Marcus Weldon,Bell Labs,,,,,,"Marcus Weldon, Alcatel-Lucent’s Chief Technical Officer and President of Bell Labs, shares his inside view of how the company has changed its approach to commercializing Bell Labs innovations to get paradigm-changing technologies to market faster than ever."
5,laser,Optical,Lightwave,Arthur Schawlow,,,,,,,"Made 19 years after the laser was invented, this 1979 film documents the various uses that had developed for this particular bit of technology conceived of at Bell Laboratories."
6,Marcus Weldon on innovation (HD),MULTI-MEDIA,,,,,,,,,"Marcus Weldon, Alcatel-Lucent CTO and President of Bell Labs, discusses Alcatel-Lucent’s ability to harness its innovation towards technologies for an ultra-connected, cloud shifted world. He also discusses Bell Labs vision and where future innovation can take u"
8,Solar_cell,Physics,Solar Energy,,,,,,,,"In the early 1950s, while working on semiconductor research, Bell Labs scientist Russell Ohl discovered that sunlight striking a wafer of silicon would produce large numbers of free electrons. In 1954, G.L. Pearson, C.S. Fuller, and D.M. Chapin did a test with strips of silicon placed in sunlight, where they captured the free electrons in the strips and turned them into electrical current. This 1978 film interviews Pearson, Fuller and Chapin about their invention, how they came to create it, and what they see for applications for the technology."
9,telstar,Wireless,Satellites,Broadband,Television,,,,,,"The story of how the Bell System, in cooperation with NASA, developed the Telstar satellite and participated in the launch and the subsequent successful transmission of signals to and from the earth and space. The film is from 1962."
10,The Shannon Limit - Bell Labs (HD),Multi Media,Networking,,,,,,,,Claude Shannon’s creation in the 1940’s of the subject of information theory is arguably one of the great intellectual achievements of the twentieth century. Discover who was Claude Shannon and what is the Shannon Limit.
11,"Copper, Future Impossible - The Many Lives of Copper",Physics,Cable,"Paul Spruyt, Carl Nuzman, Jochen Maes, Peter vetter, Willem Verbiest, ",DSL,Capacity,Vectoring,H.O.P.E.,,,100 mgbs
12,"Optical,  Future Impossible - The Story of Light",Optical,Laser,"Peter Winzer, Andy Chraplyvy, Herwig Kolgelnik, Andreas Leven, Sebastien Bigo",Crawford Hill,Bandwitch,100G ,400G,,,A review of fiber optic and Laser technology - Challenge - Funamental limit of fiber -Special Multiplexing
13,"Wireless, Future Impossible - The Network of You",Wireless,,"Dick Frenkiel, Jerry Foshini, Tod Sizer, Oliver Blume, Hardy HalbauerMarcus Weldon,",Cellular,MIMO,Millimeter Waves,Beam Forming,,,
14,tod_sizer_lightradio_1,Wireless,,,,,,,,,"Tod Sizer, Head of Wireless Research for Alcatel-Lucent Bell Labs, talks about developing the lightRadio antenna module."
15,transistor,Physics,Microelectronics,Walter Brattain,William Shockley,Nobel,Vacuum Tube,,,,"lightRadio represents a new architecture where the base station, typically located at the base of each cell"
16,CCD,Physics,"George Smith, Willard Boyle",Solid State Camera,Pixel,,,,,,"In 1969, Willard Boyle and George E. Smith invented the charge coupled device, which makes modern-day digital photography possible. Originally created for use in picturephones, the CCD evolved to allow camera makers to do away with bulky vacuum tubes, and to enable new types of computer storage."
17,Information_Theory,Multi-Media,Claude Shannon,Mathematics,Networking,,,,,,A documentary on the development of Information Theory by Claude Shannon.
18,Unix_making_computers_easier.mp4,Computing,Dennis Ritchie,Operating System,Software,,,,,,"This 23-minute film about UNIX was designed for students with an interest in engineering, math, computer science or other sciences. The film was made available to the public in December 1982. It covers different ways that UNIX could be employed practically in a computing environment. Another film about UNIX released at the same time, “The UNIX System: Making Computers More Productive,” was aimed at computer science majors and corporate trainees, and presented a more detailed discussion of the UNIX system and its various applications."
19,50th_ann_remotecomputing,Computing,,George Stibitz,Internet,Electrical Digital Computer,,,,,"George Stibitz, back in 1940, put together a neat and unusual project. He imagined that one could use radio relays to transmit information to computers. So an experiment was set up—one that ended up being, essentially, the first data transmitted over a phone line, a proto-modem. He presented this at a symposium at Dartmouth College in September, 1940. After presenting his paper, he demonstrated his system, which was connected via the phone lines to the computer at Bell Labs in NYC. The system was open to members of the audience for the next few hours. It did simple calculations in NYC and transmitted the solutions back to New Hampshire."
20,A_Fundamental_Scientst,Physics,,Philip Anderson,,,,,,,"This film profiles Philip W. Anderson, winner of the Nobel Prize in Physics in 1977. Anderson has been referred to as ""the most creative physicist in the world."""
21,AMPS,Wireless,,,Mobile Telephones,Cellular ,Chicago,Wireless,,,"Describes the planned introduction of AMPS--advanced mobile phone service;
later known as cellular telephone service, and how it will vastly increase
the availability of car and other mobile telephones."
22,FAR_Sound,Multi-Media,,,Bell Labs,,,,,,"This film, The Far Sound, examines how technologies invented at Bell Laboratories and developed by the Bell System contributed to making direct-dial, long-distance telephone service possible. It depicts how the various fields and departments at the Labs came together in this singular enterprise, culminating in common service for all. The film’s title, The Far Sound, is the alternate translation of the Greek “Telephone.”"
23,Negative_Feedback,Physics,,Harold Black,Amplifier,Vacuum Tube,Static,,,,The history of the Negative Feedback Amplifier with Harold Black talking about his work on the discovery of the Negative Feedback Amplifier which
24,Bell Labs 5G and more -- Tod Sizer (HD),Wireless,,Tod Sizer,Mobile,5G,Wireless Networks,Cloud,,,
25,Addressing the Future Innovation and Partnerships -- Marcus Weldon (HD),Wireless,,,Cloud,Virtualized Network,LTE,SDN,,,Addressing the Future: Innovation and Partnerships
26,computer_graphics_animation_bell-labs.mp4,Computing,,Michael Noll,Computer Art,,,,,,Historical piece on Harold Black and his work
27,Alcatel Lucent - Marcus Weldon - ENGLISH CLEAN - MASTER,Multi-Media,,Marcus Weldon,,,,,,,
28,Matter_Waves,Physics,,Lester Germer,Wave Nature of Matter,Nobel,,,,,"Shown in college classrooms (occasionally, still!), this 28-minute film gives both historical and scientific insight to the wave nature of elementary, atomic-level particles. The film’s guides are Lester Germer and Alan Holden, both Bell Laboratories scientists."
,,,,,,,,,,,
,CATEGORY LIST,Multi-Media,,,,,,,,,
,,Medical Technology,,,,,,,,,
,this means there's multiple files for these assets and we still need to determine which is best,Physics,,,,,,,,,
,,Mathematics,,,,,,,,,
,,Wireless,,,,,,,,,
,,Physics,,,,,,,,,
,,Optical,,,,,,,,,
,,Computing,,,,,,,,,